{"$schema":"https://json-schema.org/draft/2020-12/schema","$id":"area-one-control-family-manifest/1.0","type":"object","additionalProperties":false,"required":["schema_version","generator_version","families","manifest_hash"],"properties":{"schema_version":{"const":"area-one-control-family-manifest/1.0"},"generator_version":{"const":"area-one-control-random-v1"},"families":{"type":"array","minItems":100,"maxItems":100,"items":{"type":"object","additionalProperties":false,"required":["family_id","kind","structured_subkind","members"],"properties":{"family_id":{"type":"string","pattern":"^control-[0-9]{3}$"},"kind":{"enum":["structured","random"]},"structured_subkind":{"type":["string","null"],"enum":["cyclic","reflected",null]},"members":{"type":"array","minItems":4,"maxItems":4,"items":{"type":"object","additionalProperties":false,"required":["R","destination_rows","displacements","retained_genuine_edges","cardinality","disjoint"],"properties":{"R":{"type":"integer","minimum":6,"maximum":9},"destination_rows":{"type":"array","minItems":5,"maxItems":8,"uniqueItems":true,"items":{"type":"integer","minimum":1,"maximum":8}},"displacements":{"type":"array","minItems":5,"maxItems":8,"items":{"type":"integer","minimum":-7,"maximum":8}},"retained_genuine_edges":{"type":"integer","minimum":0,"maximum":8},"cardinality":{"type":"integer","minimum":5,"maximum":8},"disjoint":{"const":true}}}}}}},"manifest_hash":{"$ref":"#/$defs/hash"}},"$defs":{"hash":{"type":"string","pattern":"^sha256:[0-9a-f]{64}$"}}}