{"families":[{"family_id":"control-000","kind":"structured","members":[{"R":6,"cardinality":5,"destination_rows":[2,3,4,5,1],"disjoint":true,"displacements":[1,1,1,1,-4],"retained_genuine_edges":0},{"R":7,"cardinality":6,"destination_rows":[2,3,4,5,6,1],"disjoint":true,"displacements":[1,1,1,1,1,-5],"retained_genuine_edges":0},{"R":8,"cardinality":7,"destination_rows":[2,3,4,5,6,7,1],"disjoint":true,"displacements":[1,1,1,1,1,1,-6],"retained_genuine_edges":0},{"R":9,"cardinality":8,"destination_rows":[2,3,4,5,6,7,8,1],"disjoint":true,"displacements":[1,1,1,1,1,1,1,-7],"retained_genuine_edges":0}],"structured_subkind":"cyclic"},{"family_id":"control-001","kind":"structured","members":[{"R":6,"cardinality":5,"destination_rows":[3,4,5,1,2],"disjoint":true,"displacements":[2,2,2,-3,-3],"retained_genuine_edges":0},{"R":7,"cardinality":6,"destination_rows":[3,4,5,6,1,2],"disjoint":true,"displacements":[2,2,2,2,-4,-4],"retained_genuine_edges":0},{"R":8,"cardinality":7,"destination_rows":[3,4,5,6,7,1,2],"disjoint":true,"displacements":[2,2,2,2,2,-5,-5],"retained_genuine_edges":0},{"R":9,"cardinality":8,"destination_rows":[3,4,5,6,7,8,1,2],"disjoint":true,"displacements":[2,2,2,2,2,2,-6,-6],"retained_genuine_edges":0}],"structured_subkind":"cyclic"},{"family_id":"control-002","kind":"structured","members":[{"R":6,"cardinality":5,"destination_rows":[4,5,1,2,3],"disjoint":true,"displacements":[3,3,-2,-2,-2],"retained_genuine_edges":0},{"R":7,"cardinality":6,"destination_rows":[4,5,6,1,2,3],"disjoint":true,"displacements":[3,3,3,-3,-3,-3],"retained_genuine_edges":0},{"R":8,"cardinality":7,"destination_rows":[4,5,6,7,1,2,3],"disjoint":true,"displacements":[3,3,3,3,-4,-4,-4],"retained_genuine_edges":0},{"R":9,"cardinality":8,"destination_rows":[4,5,6,7,8,1,2,3],"disjoint":true,"displacements":[3,3,3,3,3,-5,-5,-5],"retained_genuine_edges":0}],"structured_subkind":"cyclic"},{"family_id":"control-003","kind":"structured","members":[{"R":6,"cardinality":5,"destination_rows":[5,1,2,3,4],"disjoint":true,"displacements":[4,-1,-1,-1,-1],"retained_genuine_edges":0},{"R":7,"cardinality":6,"destination_rows":[5,6,1,2,3,4],"disjoint":true,"displacements":[4,4,-2,-2,-2,-2],"retained_genuine_edges":0},{"R":8,"cardinality":7,"destination_rows":[5,6,7,1,2,3,4],"disjoint":true,"displacements":[4,4,4,-3,-3,-3,-3],"retained_genuine_edges":0},{"R":9,"cardinality":8,"destination_rows":[5,6,7,8,1,2,3,4],"disjoint":true,"displacements":[4,4,4,4,-4,-4,-4,-4],"retained_genuine_edges":0}],"structured_subkind":"cyclic"},{"family_id":"control-004","kind":"structured","members":[{"R":6,"cardinality":5,"destination_rows":[5,4,3,2,1],"disjoint":true,"displacements":[4,2,0,-2,-4],"retained_genuine_edges":1},{"R":7,"cardinality":6,"destination_rows":[6,5,4,3,2,1],"disjoint":true,"displacements":[5,3,1,-1,-3,-5],"retained_genuine_edges":0},{"R":8,"cardinality":7,"destination_rows":[7,6,5,4,3,2,1],"disjoint":true,"displacements":[6,4,2,0,-2,-4,-6],"retained_genuine_edges":1},{"R":9,"cardinality":8,"destination_rows":[8,7,6,5,4,3,2,1],"disjoint":true,"displacements":[7,5,3,1,-1,-3,-5,-7],"retained_genuine_edges":0}],"structured_subkind":"reflected"},{"family_id":"control-005","kind":"structured","members":[{"R":6,"cardinality":5,"destination_rows":[4,3,2,1,5],"disjoint":true,"displacements":[3,1,-1,-3,0],"retained_genuine_edges":1},{"R":7,"cardinality":6,"destination_rows":[5,4,3,2,1,6],"disjoint":true,"displacements":[4,2,0,-2,-4,0],"retained_genuine_edges":2},{"R":8,"cardinality":7,"destination_rows":[6,5,4,3,2,1,7],"disjoint":true,"displacements":[5,3,1,-1,-3,-5,0],"retained_genuine_edges":1},{"R":9,"cardinality":8,"destination_rows":[7,6,5,4,3,2,1,8],"disjoint":true,"displacements":[6,4,2,0,-2,-4,-6,0],"retained_genuine_edges":2}],"structured_subkind":"reflected"},{"family_id":"control-006","kind":"structured","members":[{"R":6,"cardinality":5,"destination_rows":[3,2,1,5,4],"disjoint":true,"displacements":[2,0,-2,1,-1],"retained_genuine_edges":1},{"R":7,"cardinality":6,"destination_rows":[4,3,2,1,6,5],"disjoint":true,"displacements":[3,1,-1,-3,1,-1],"retained_genuine_edges":0},{"R":8,"cardinality":7,"destination_rows":[5,4,3,2,1,7,6],"disjoint":true,"displacements":[4,2,0,-2,-4,1,-1],"retained_genuine_edges":1},{"R":9,"cardinality":8,"destination_rows":[6,5,4,3,2,1,8,7],"disjoint":true,"displacements":[5,3,1,-1,-3,-5,1,-1],"retained_genuine_edges":0}],"structured_subkind":"reflected"},{"family_id":"control-007","kind":"structured","members":[{"R":6,"cardinality":5,"destination_rows":[2,1,5,4,3],"disjoint":true,"displacements":[1,-1,2,0,-2],"retained_genuine_edges":1},{"R":7,"cardinality":6,"destination_rows":[3,2,1,6,5,4],"disjoint":true,"displacements":[2,0,-2,2,0,-2],"retained_genuine_edges":2},{"R":8,"cardinality":7,"destination_rows":[4,3,2,1,7,6,5],"disjoint":true,"displacements":[3,1,-1,-3,2,0,-2],"retained_genuine_edges":1},{"R":9,"cardinality":8,"destination_rows":[5,4,3,2,1,8,7,6],"disjoint":true,"displacements":[4,2,0,-2,-4,2,0,-2],"retained_genuine_edges":2}],"structured_subkind":"reflected"},{"family_id":"control-008","kind":"structured","members":[{"R":6,"cardinality":5,"destination_rows":[1,5,4,3,2],"disjoint":true,"displacements":[0,3,1,-1,-3],"retained_genuine_edges":1},{"R":7,"cardinality":6,"destination_rows":[2,1,6,5,4,3],"disjoint":true,"displacements":[1,-1,3,1,-1,-3],"retained_genuine_edges":0},{"R":8,"cardinality":7,"destination_rows":[3,2,1,7,6,5,4],"disjoint":true,"displacements":[2,0,-2,3,1,-1,-3],"retained_genuine_edges":1},{"R":9,"cardinality":8,"destination_rows":[4,3,2,1,8,7,6,5],"disjoint":true,"displacements":[3,1,-1,-3,3,1,-1,-3],"retained_genuine_edges":0}],"structured_subkind":"reflected"},{"family_id":"control-009","kind":"random","members":[{"R":6,"cardinality":5,"destination_rows":[4,3,1,2,5],"disjoint":true,"displacements":[3,1,-2,-2,0],"retained_genuine_edges":1},{"R":7,"cardinality":6,"destination_rows":[4,1,5,3,6,2],"disjoint":true,"displacements":[3,-1,2,-1,1,-4],"retained_genuine_edges":0},{"R":8,"cardinality":7,"destination_rows":[4,6,7,3,1,5,2],"disjoint":true,"displacements":[3,4,4,-1,-4,-1,-5],"retained_genuine_edges":0},{"R":9,"cardinality":8,"destination_rows":[6,4,7,2,1,8,3,5],"disjoint":true,"displacements":[5,2,4,-2,-4,2,-4,-3],"retained_genuine_edges":0}],"structured_subkind":null},{"family_id":"control-010","kind":"random","members":[{"R":6,"cardinality":5,"destination_rows":[4,1,3,2,5],"disjoint":true,"displacements":[3,-1,0,-2,0],"retained_genuine_edges":2},{"R":7,"cardinality":6,"destination_rows":[1,5,6,2,4,3],"disjoint":true,"displacements":[0,3,3,-2,-1,-3],"retained_genuine_edges":1},{"R":8,"cardinality":7,"destination_rows":[1,6,2,7,5,3,4],"disjoint":true,"displacements":[0,4,-1,3,0,-3,-3],"retained_genuine_edges":2},{"R":9,"cardinality":8,"destination_rows":[8,7,2,6,1,5,4,3],"disjoint":true,"displacements":[7,5,-1,2,-4,-1,-3,-5],"retained_genuine_edges":0}],"structured_subkind":null},{"family_id":"control-011","kind":"random","members":[{"R":6,"cardinality":5,"destination_rows":[5,3,1,2,4],"disjoint":true,"displacements":[4,1,-2,-2,-1],"retained_genuine_edges":0},{"R":7,"cardinality":6,"destination_rows":[4,6,1,5,3,2],"disjoint":true,"displacements":[3,4,-2,1,-2,-4],"retained_genuine_edges":0},{"R":8,"cardinality":7,"destination_rows":[4,7,1,5,3,6,2],"disjoint":true,"displacements":[3,5,-2,1,-2,0,-5],"retained_genuine_edges":1},{"R":9,"cardinality":8,"destination_rows":[5,2,4,3,1,7,6,8],"disjoint":true,"displacements":[4,0,1,-1,-4,1,-1,0],"retained_genuine_edges":2}],"structured_subkind":null},{"family_id":"control-012","kind":"random","members":[{"R":6,"cardinality":5,"destination_rows":[2,4,3,1,5],"disjoint":true,"displacements":[1,2,0,-3,0],"retained_genuine_edges":2},{"R":7,"cardinality":6,"destination_rows":[2,5,3,4,6,1],"disjoint":true,"displacements":[1,3,0,0,1,-5],"retained_genuine_edges":2},{"R":8,"cardinality":7,"destination_rows":[7,6,4,1,5,3,2],"disjoint":true,"displacements":[6,4,1,-3,0,-3,-5],"retained_genuine_edges":1},{"R":9,"cardinality":8,"destination_rows":[8,3,7,6,1,5,2,4],"disjoint":true,"displacements":[7,1,4,2,-4,-1,-5,-4],"retained_genuine_edges":0}],"structured_subkind":null},{"family_id":"control-013","kind":"random","members":[{"R":6,"cardinality":5,"destination_rows":[2,4,1,5,3],"disjoint":true,"displacements":[1,2,-2,1,-2],"retained_genuine_edges":0},{"R":7,"cardinality":6,"destination_rows":[2,5,3,1,6,4],"disjoint":true,"displacements":[1,3,0,-3,1,-2],"retained_genuine_edges":1},{"R":8,"cardinality":7,"destination_rows":[6,3,1,2,7,5,4],"disjoint":true,"displacements":[5,1,-2,-2,2,-1,-3],"retained_genuine_edges":0},{"R":9,"cardinality":8,"destination_rows":[1,5,7,3,4,8,2,6],"disjoint":true,"displacements":[0,3,4,-1,-1,2,-5,-2],"retained_genuine_edges":1}],"structured_subkind":null},{"family_id":"control-014","kind":"random","members":[{"R":6,"cardinality":5,"destination_rows":[1,3,5,4,2],"disjoint":true,"displacements":[0,1,2,0,-3],"retained_genuine_edges":2},{"R":7,"cardinality":6,"destination_rows":[2,6,3,4,1,5],"disjoint":true,"displacements":[1,4,0,0,-4,-1],"retained_genuine_edges":2},{"R":8,"cardinality":7,"destination_rows":[2,3,7,4,6,5,1],"disjoint":true,"displacements":[1,1,4,0,1,-1,-6],"retained_genuine_edges":1},{"R":9,"cardinality":8,"destination_rows":[1,7,5,4,2,8,6,3],"disjoint":true,"displacements":[0,5,2,0,-3,2,-1,-5],"retained_genuine_edges":2}],"structured_subkind":null},{"family_id":"control-015","kind":"random","members":[{"R":6,"cardinality":5,"destination_rows":[5,4,1,3,2],"disjoint":true,"displacements":[4,2,-2,-1,-3],"retained_genuine_edges":0},{"R":7,"cardinality":6,"destination_rows":[6,2,4,1,3,5],"disjoint":true,"displacements":[5,0,1,-3,-2,-1],"retained_genuine_edges":1},{"R":8,"cardinality":7,"destination_rows":[5,2,7,1,3,4,6],"disjoint":true,"displacements":[4,0,4,-3,-2,-2,-1],"retained_genuine_edges":1},{"R":9,"cardinality":8,"destination_rows":[1,8,4,6,7,3,5,2],"disjoint":true,"displacements":[0,6,1,2,2,-3,-2,-6],"retained_genuine_ed